740,Severe endocarditis,"Infectious disease, acute episode, severe","has a high fever and pain, and feels very weak, which causes great difficulty with daily activities.",0.133,0.088,0.19
741,Severe heart failure due to endocarditis,"Heart failure, severe","is short of breath and feels tired when at rest. The person avoids any physical activity, for fear of worsening the breathing problems. ",0.179,0.122,0.251
742,Moderate heart failure due to endocarditis,"Heart failure, moderate","is short of breath and easily tires with minimal physical activity, such as walking only a short distance. The person feels comfortable at rest but avoids moderate activity.",0.072,0.047,0.103
743,Moderate other cardiovascular diseases,"Heart failure, moderate","is short of breath and easily tires with minimal physical activity, such as walking only a short distance. The person feels comfortable at rest but avoids moderate activity.",0.072,0.047,0.103
744,Severe heart failure due to other cardiovascular diseases,"Heart failure, severe","is short of breath and feels tired when at rest. The person avoids any physical activity, for fear of worsening the breathing problems. ",0.179,0.122,0.251
745,Asymptomatic other cardiovascular diseases,Asymptomatic,--,,,
746,Mild other cardiovascular diseases,"Heart failure, mild","is short of breath and easily tires with moderate physical activity, such as walking uphill or more than a quarter-mile on level ground. The person feels comfortable at rest or during activities requiring less effort.",0.041,0.026,0.062
747,Asymptomatic and mild heart failure due to other cardiovascular diseases,"Heart failure, mild","is short of breath and easily tires with moderate physical activity, such as walking uphill or more than a quarter-mile on level ground. The person feels comfortable at rest or during activities requiring less effort.",0.041,0.026,0.062
748,Severe other cardiovascular diseases,"Heart failure, severe","is short of breath and feels tired when at rest. The person avoids any physical activity, for fear of worsening the breathing problems. ",0.179,0.122,0.251
749,Moderate heart failure due to other cardiovascular diseases,"Heart failure, moderate","is short of breath and easily tires with minimal physical activity, such as walking only a short distance. The person feels comfortable at rest but avoids moderate activity.",0.072,0.047,0.103
750,Severe heart failure due to severe chronic obstructive pulmonary disease,"Severe COPD and other chronic respiratory, with severe heart failure",--,,,
751,Asymptomatic and mild heart failure due to severe chronic obstructive pulmonary disease,"Severe COPD and other chronic respiratory, with mild heart failure",--,,,
752,Moderate chronic obstructive pulmonary disease,"COPD and other chronic respiratory problems, moderate","has cough, wheezing and shortness of breath, even after light physical activity. The person feels tired and can walk only short distances or climb only a few stairs.",0.225,0.153,0.31
753,Moderate heart failure due to severe chronic obstructive pulmonary disease,"Severe COPD and other chronic respiratory, with moderate heart failure",--,,,
754,Asymptomatic chronic obstructive pulmonary disease,Asymptomatic,--,,,
755,Mild chronic obstructive pulmonary disease,"COPD and other chronic respiratory problems, mild","has cough and shortness of breath after heavy physical activity, but is able to walk long distances and climb stairs.",0.019,0.011,0.033
756,Severe chronic obstructive pulmonary disease without heart failure,"COPD and other chronic respiratory problems, severe","has cough, wheezing and shortness of breath all the time. The person has great difficulty walking even short distances or climbing any stairs, feels tired when at rest, and is anxious.",0.408,0.273,0.556
757,Moderate heart failure due to severe silicosis,"Severe COPD and other chronic respiratory, with moderate heart failure",--,,,
758,Mild silicosis,"COPD and other chronic respiratory problems, mild","has cough and shortness of breath after heavy physical activity, but is able to walk long distances and climb stairs.",0.019,0.011,0.033
759,Moderate silicosis,"COPD and other chronic respiratory problems, moderate","has cough, wheezing and shortness of breath, even after light physical activity. The person feels tired and can walk only short distances or climb only a few stairs.",0.225,0.153,0.31
760,Asymptomatic and mild heart failure due to severe silicosis,"Severe COPD and other chronic respiratory, with mild heart failure",--,,,
761,Severe silicosis without heart failure,"COPD and other chronic respiratory problems, severe","has cough, wheezing and shortness of breath all the time. The person has great difficulty walking even short distances or climbing any stairs, feels tired when at rest, and is anxious.",0.408,0.273,0.556
762,Asymptomatic silicosis,Asymptomatic,--,,,
763,Severe heart failure due to severe silicosis,"Severe COPD and other chronic respiratory, with severe heart failure",--,,,
764,Asymptomatic and mild heart failure due to severe asbestosis,"Severe COPD and other chronic respiratory, with mild heart failure",--,,,
765,Moderate heart failure due to severe asbestosis,"Severe COPD and other chronic respiratory, with moderate heart failure",--,,,
766,Mild asbestosis,"COPD and other chronic respiratory problems, mild","has cough and shortness of breath after heavy physical activity, but is able to walk long distances and climb stairs.",0.019,0.011,0.033
767,Severe asbestosis without heart failure,"COPD and other chronic respiratory problems, severe","has cough, wheezing and shortness of breath all the time. The person has great difficulty walking even short distances or climbing any stairs, feels tired when at rest, and is anxious.",0.408,0.273,0.556
768,Severe heart failure due to severe asbestosis,"Severe COPD and other chronic respiratory, with severe heart failure",--,,,
769,Moderate asbestosis,"COPD and other chronic respiratory problems, moderate","has cough, wheezing and shortness of breath, even after light physical activity. The person feels tired and can walk only short distances or climb only a few stairs.",0.225,0.153,0.31
770,Asymptomatic asbestosis,Asymptomatic,--,,,
771,Severe coal workers pneumoconiosis without heart failure,"COPD and other chronic respiratory problems, severe","has cough, wheezing and shortness of breath all the time. The person has great difficulty walking even short distances or climbing any stairs, feels tired when at rest, and is anxious.",0.408,0.273,0.556
772,Mild coal workers pneumoconiosis,"COPD and other chronic respiratory problems, mild","has cough and shortness of breath after heavy physical activity, but is able to walk long distances and climb stairs.",0.019,0.011,0.033
773,Severe heart failure due to severe coal workers pneumoconiosis,"Severe COPD and other chronic respiratory, with severe heart failure",--,,,
774,Asymptomatic and mild heart failure due to severe coal workers pneumoconiosis,"Severe COPD and other chronic respiratory, with mild heart failure",--,,,
775,Asymptomatic coal workers pneumoconiosis,Asymptomatic,--,,,
776,Moderate heart failure due to severe coal workers pneumoconiosis,"Severe COPD and other chronic respiratory, with moderate heart failure",--,,,
777,Moderate coal workers pneumoconiosis,"COPD and other chronic respiratory problems, moderate","has cough, wheezing and shortness of breath, even after light physical activity. The person feels tired and can walk only short distances or climb only a few stairs.",0.225,0.153,0.31
778,Moderate other pneumoconiosis,"COPD and other chronic respiratory problems, moderate","has cough, wheezing and shortness of breath, even after light physical activity. The person feels tired and can walk only short distances or climb only a few stairs.",0.225,0.153,0.31
779,Asymptomatic other pneumoconiosis,Asymptomatic,--,,,
780,Mild other pneumoconiosis,"COPD and other chronic respiratory problems, mild","has cough and shortness of breath after heavy physical activity, but is able to walk long distances and climb stairs.",0.019,0.011,0.033
781,Severe heart failure due to severe other pneumoconiosis,"Severe COPD and other chronic respiratory, with severe heart failure",--,,,
782,Severe other pneumoconiosis without heart failure,"COPD and other chronic respiratory problems, severe","has cough, wheezing and shortness of breath all the time. The person has great difficulty walking even short distances or climbing any stairs, feels tired when at rest, and is anxious.",0.408,0.273,0.556
783,Moderate heart failure due to severe other pneumoconiosis,"Severe COPD and other chronic respiratory, with moderate heart failure",--,,,
784,Asymptomatic and mild heart failure due to severe other pneumoconiosis,"Severe COPD and other chronic respiratory, with mild heart failure",--,,,
785,Controlled asthma,"Asthma, controlled","has wheezing and cough once a month, which does not cause difficulty with daily activities. ",0.015,0.007,0.026
786,Uncontrolled asthma,"Asthma, uncontrolled","has wheezing, cough and shortness of breath more than twice a week, which causes difficulty with daily activities and sometimes wakes the person at night.",0.133,0.086,0.192
787,Asymptomatic asthma,Asymptomatic,--,,,
788,Partially controlled asthma,"Asthma, partially controlled","has wheezing and cough once a week, which causes some difficulty with daily activities.",0.036,0.022,0.055
789,Severe heart failure due to severe interstitial lung disease and pulmonary sarcoidosis,"Severe COPD and other chronic respiratory, with severe heart failure",--,,,
790,Severe interstitial lung disease and pulmonary sarcoidosis without heart failure,"COPD and other chronic respiratory problems, severe","has cough, wheezing and shortness of breath all the time. The person has great difficulty walking even short distances or climbing any stairs, feels tired when at rest, and is anxious.",0.408,0.273,0.556
791,Moderate heart failure due to severe interstitial lung disease and pulmonary sarcoidosis,"Severe COPD and other chronic respiratory, with moderate heart failure",--,,,
792,Mild interstitial lung disease and pulmonary sarcoidosis,"COPD and other chronic respiratory problems, mild","has cough and shortness of breath after heavy physical activity, but is able to walk long distances and climb stairs.",0.019,0.011,0.033
793,Moderate interstitial lung disease and pulmonary sarcoidosis,"COPD and other chronic respiratory problems, moderate","has cough, wheezing and shortness of breath, even after light physical activity. The person feels tired and can walk only short distances or climb only a few stairs.",0.225,0.153,0.31
794,Asymptomatic interstitial lung disease and pulmonary sarcoidosis,Asymptomatic,--,,,
795,Asymptomatic and mild heart failure due to severe interstitial lung disease and pulmonary sarcoidosis,"Severe COPD and other chronic respiratory, with mild heart failure",--,,,
796,Other chronic respiratory diseases,"Post-COMO calculation for residuals (YLL/YLD ratio, other methods)",--,,,
797,"Cirrhosis and other chronic liver diseases due to hepatitis B, compensated",Asymptomatic,--,,,
798,"Cirrhosis and other chronic liver diseases due to hepatitis B, decompensated",Decompensated cirrhosis of the liver ,"has a swollen belly and swollen legs. The person feels weakness, fatigue and loss of appetite.",0.178,0.123,0.25
799,"Cirrhosis and other chronic liver diseases due to hepatitis C, decompensated",Decompensated cirrhosis of the liver ,"has a swollen belly and swollen legs. The person feels weakness, fatigue and loss of appetite.",0.178,0.123,0.25
800,"Cirrhosis and other chronic liver diseases due to hepatitis C, compensated",Asymptomatic,--,,,
801,"Cirrhosis and other chronic liver diseases due to alcohol, compensated",Asymptomatic,--,,,
802,"Cirrhosis and other chronic liver diseases due to alcohol, decompensated",Decompensated cirrhosis of the liver ,"has a swollen belly and swollen legs. The person feels weakness, fatigue and loss of appetite.",0.178,0.123,0.25
803,"Cirrhosis and other chronic liver diseases due to other cause, compensated",Asymptomatic,--,,,
804,"Cirrhosis and other chronic liver diseases due to other cause, decompensated",Decompensated cirrhosis of the liver ,"has a swollen belly and swollen legs. The person feels weakness, fatigue and loss of appetite.",0.178,0.123,0.25
805,Severe anemia due to peptic ulcer disease,"Anemia, severe","feels very weak, tired and short of breath, and has problems with activities that require physical effort or deep concentration.",0.149,0.101,0.209
806,Moderate symptomatic peptic ulcer disease with mild anemia,Moderate abdominal pain with mild anemia,(combined DW),0.118,0.081,0.163
807,Moderate symptomatic peptic ulcer disease with moderate anemia,Moderate abdominal pain with moderate anemia,(combined DW),0.16,0.109,0.22
808,Moderate symptomatic peptic ulcer disease without anemia,"Abdominopelvic problem, moderate",has pain in the belly and feels nauseous. The person has difficulties with daily activities. ,0.114,0.078,0.159
809,Mild anemia due to peptic ulcer disease,"Anemia, mild","feels slightly tired and weak at times, but this does not interfere with normal daily activities.",0.004,0.001,0.008
810,Asymptomatic peptic ulcer disease without anemia,Asymptomatic,--,,,
811,Mild symptomatic peptic ulcer disease with severe anemia,Mild abdominal pain with severe anemia,(combined DW),,,
812,Moderate anemia due to peptic ulcer disease,"Anemia, moderate","feels moderate fatigue, weakness, and shortness of breath after exercise, making daily activities more difficult.",0.052,0.034,0.076
813,Moderate symptomatic peptic ulcer disease with severe anemia,Mild abdominal pain with severe anemia,(combined DW),,,
814,Asymptomatic peptic ulcer disease with moderate anemia ,"Anemia, moderate","feels moderate fatigue, weakness, and shortness of breath after exercise, making daily activities more difficult.",0.052,0.034,0.076
815,Asymptomatic peptic ulcer disease with severe anemia ,"Anemia, severe","feels very weak, tired and short of breath, and has problems with activities that require physical effort or deep concentration.",0.149,0.101,0.209
816,Mild symptomatic peptic ulcer disease without anemia,"Abdominopelvic problem, mild",has some pain in the belly that causes nausea but does not interfere with daily activities.,0.011,0.005,0.021
817,Mild symptomatic peptic ulcer disease with moderate anemia,Mild abdominal pain with moderate anemia,(combined DW),,,
818,Asymptomatic peptic ulcer disease with mild anemia ,"Anemia, mild","feels slightly tired and weak at times, but this does not interfere with normal daily activities.",0.004,0.001,0.008
819,Mild symptomatic peptic ulcer disease with mild anemia,Mild abdominal pain with mild anemia,(combined DW),,,
820,Mild anemia due to gastritis and duodenitis,"Anemia, mild","feels slightly tired and weak at times, but this does not interfere with normal daily activities.",0.004,0.001,0.008
821,Mild symptomatic gastritis and duodenitis with moderate anemia,Mild abdominal pain with moderate anemia,(combined DW),,,
822,Asymptomatic gastritis and duodenitis with moderate anemia,"Anemia, moderate","feels moderate fatigue, weakness, and shortness of breath after exercise, making daily activities more difficult.",0.052,0.034,0.076
823,Moderate symptomatic gastritis and duodenitis with severe anemia,Moderate abdominal pain with severe anemia,(combined DW),0.246,0.171,0.334
824,Moderate anemia due to gastritis and duodenitis,"Anemia, moderate","feels moderate fatigue, weakness, and shortness of breath after exercise, making daily activities more difficult.",0.052,0.034,0.076
825,Asymptomatic gastritis and duodenitis without anemia,Asymptomatic,--,,,
826,Moderate symptomatic gastritis and duodenitis with moderate anemia,Moderate abdominal pain with moderate anemia,(combined DW),0.16,0.109,0.22
827,Asymptomatic gastritis and duodenitis with mild anemia,"Anemia, mild","feels slightly tired and weak at times, but this does not interfere with normal daily activities.",0.004,0.001,0.008
828,Asymptomatic gastritis and duodenitis with severe anemia,"Anemia, severe","feels very weak, tired and short of breath, and has problems with activities that require physical effort or deep concentration.",0.149,0.101,0.209
829,Mild symptomatic gastritis and duodenitis without anemia,"Abdominopelvic problem, mild",has some pain in the belly that causes nausea but does not interfere with daily activities.,0.011,0.005,0.021
830,Mild symptomatic gastritis and duodenitis with severe anemia,Mild abdominal pain with severe anemia,(combined DW),,,
831,Severe anemia due to gastritis and duodenitis,"Anemia, severe","feels very weak, tired and short of breath, and has problems with activities that require physical effort or deep concentration.",0.149,0.101,0.209
832,Mild symptomatic gastritis and duodenitis with mild anemia,Mild abdominal pain with mild anemia,(combined DW),,,
833,Moderate symptomatic gastritis and duodenitis with mild anemia,Moderate abdominal pain with mild anemia,(combined DW),0.118,0.081,0.163
834,Moderate symptomatic gastritis and duodenitis without anemia ,"Abdominopelvic problem, moderate",has pain in the belly and feels nauseous. The person has difficulties with daily activities. ,0.114,0.078,0.159
835,Appendicitis,"Abdominopelvic problem, severe",has severe pain in the belly and feels nauseous. The person is anxious and unable to carry out daily activities.,0.324,0.22,0.442
836,Paralytic ileus and intestinal obstruction,"Abdominopelvic problem, severe",has severe pain in the belly and feels nauseous. The person is anxious and unable to carry out daily activities.,0.324,0.22,0.442
837,"Asymptomatic inguinal, femoral, and abdominal hernia",Asymptomatic,--,,,
838,"Mild symptomatic inguinal, femoral and abdominal hernia","Abdominopelvic problem, mild",has some pain in the belly that causes nausea but does not interfere with daily activities.,0.011,0.005,0.021
839,"Moderate symptomatic inguinal, femoral and abdominal hernia","Abdominopelvic problem, moderate",has pain in the belly and feels nauseous. The person has difficulties with daily activities. ,0.114,0.078,0.159
840,"Severe symptomatic inguinal, femoral and abdominal hernia","Abdominopelvic problem, severe",has severe pain in the belly and feels nauseous. The person is anxious and unable to carry out daily activities.,0.324,0.22,0.442
841,Asymptomatic Crohn's disease,Asymptomatic,--,,,
842,Asymptomatic ulcerative colitis,Asymptomatic,--,,,
843,Ulcerative colitis,Crohn disease or ulcerative colitis,"has cramping abdominal pain, has diarrhea several times a day, and feels very tired for two months every year. When the person does not have symptoms, there is anxiety about them returning.",0.231,0.156,0.32
844,Crohn's disease,Crohn disease or ulcerative colitis,"has cramping abdominal pain, has diarrhea several times a day, and feels very tired for two months every year. When the person does not have symptoms, there is anxiety about them returning.",0.231,0.156,0.32
845,Vascular intestinal disorders,"Abdominopelvic problem, severe",has severe pain in the belly and feels nauseous. The person is anxious and unable to carry out daily activities.,0.324,0.22,0.442
846,Asymptomatic gallbladder and biliary diseases,Asymptomatic,--,,,
847,Severe symptomatic episodes gallbladder and biliary diseases,"Abdominopelvic problem, severe",has severe pain in the belly and feels nauseous. The person is anxious and unable to carry out daily activities.,0.324,0.22,0.442
848,Mild symptomatic episodes gallbladder and biliary diseases,"Abdominopelvic problem, mild",has some pain in the belly that causes nausea but does not interfere with daily activities.,0.011,0.005,0.021
849,Moderate symptomatic episodes gallbladder and biliary diseases ,"Abdominopelvic problem, moderate",has pain in the belly and feels nauseous. The person has difficulties with daily activities. ,0.114,0.078,0.159
850,Moderate pancreatitis episodes,"Abdominopelvic problem, moderate",has pain in the belly and feels nauseous. The person has difficulties with daily activities. ,0.114,0.078,0.159
851,Mild pancreatitis episodes,"Abdominopelvic problem, mild",has some pain in the belly that causes nausea but does not interfere with daily activities.,0.011,0.005,0.021
852,Severe pancreatitis episodes,"Abdominopelvic problem, severe",has severe pain in the belly and feels nauseous. The person is anxious and unable to carry out daily activities.,0.324,0.22,0.442
853,Other digestive diseases,"Post-COMO calculation for residuals (YLL/YLD ratio, other methods)",--,,,
854,Severe Alzheimer disease and other dementias,"Dementia, severe",has complete memory loss; no longer recognizes close family members; and requires help with all daily activities.,0.449,0.304,0.595
855,Mild Alzheimer disease and other dementias,"Dementia, mild","has some trouble remembering recent events, and finds it hard to concentrate and make decisions and plans.",0.069,0.046,0.099
856,Moderate Alzheimer disease and other dementias,"Dementia, moderate","has memory problems and confusion, feels disoriented, at times hears voices that are not real, and needs help with some daily activities.",0.377,0.252,0.508
857,Mild Parkinson disease,"Parkinson disease, mild","has mild tremors and moves a little slowly, but is able to walk and do daily activities without assistance. ",0.01,0.005,0.019
858,Moderate Parkinson disease,"Parkinson disease, moderate","has moderate tremors and moves slowly, which causes some difficulty in walking and daily activities. The person has some trouble swallowing, talking, sleeping, and remembering things.",0.267,0.181,0.372
859,Severe Parkinson disease,"Parkinson disease, severe","has severe tremors and moves very slowly, which causes great difficulty in walking and daily activities. The person falls easily and has a lot of difficulty talking, swallowing, sleeping, and remembering things. ",0.575,0.396,0.73
860,Severe epilepsy,"Epilepsy, seizures >= once a month","has sudden seizures one or more times each month, with violent muscle contractions and stiffness, loss of consciousness, and loss of urine or bowel control. Between seizures the person has memory loss and difficulty concentrating.",0.552,0.375,0.71
861,Less severe epilepsy,"Epilepsy, seizures 1-11 per year","has sudden seizures two to five times a year, with violent muscle contractions and stiffness, loss of consciousness, and loss of urine or bowel control.",0.263,0.173,0.367
862,"Seizure-free, treated epilepsy",Generic uncomplicated disease: worry and daily medication,has a chronic disease that requires medication every day and causes some worry but minimal interference with daily activities.,0.049,0.031,0.072
863,Mild multiple sclerosis,"Multiple sclerosis, mild","has mild loss of feeling in one hand, is a little unsteady while walking, has slight loss of vision in one eye, and often needs to urinate urgently.",0.183,0.124,0.253
864,Severe multiple sclerosis,"Multiple sclerosis, severe","has slurred speech and difficulty swallowing. The person has weak arms and hands, very limited and stiff leg movement, has loss of vision in both eyes and cannot control urinating.",0.719,0.534,0.858
865,Moderate multiple sclerosis,"Multiple sclerosis, moderate","needs help walking, has difficulty with writing and arm coordination, has loss of vision in one eye and cannot control urinating.",0.463,0.313,0.613
866,Asymptomatic multiple sclerosis,Asymptomatic,--,,,
867,Severe respiratory problems and speech problems due to motor neuron disease,Severe respiratory and speech problems,(combined DW),0.438,0.304,0.581
868,Moderate respiratory problems and speech problems due to motor neuron disease,Moderate respiratory and speech problems,(combined DW),0.265,0.184,0.36
869,Mild respiratory problems and speech problems due to motor neuron disease,Mild respiratory and speech problems,(combined DW),0.069,0.043,0.106
870,Severe motor impairment and speech problems due to motor neuron disease,Severe motor impairment and speech problems,(combined DW),0.432,0.306,0.572
871,Moderate motor impairment and speech problems due to motor neuron disease,Moderate motor impairment and speech problems,(combined DW),0.109,0.071,0.158
872,Mild motor impairment and speech problems due to motor neuron disease,Mild motor impairment and speech problems,(combined DW),0.061,0.038,0.094
873,Severe motor impairment and severe respiratory problems due to motor neuron disease,Severe motor impairment and severe respiratory problems,(combined DW),0.641,0.47,0.796
874,Severe motor impairment and mild respiratory problems due to motor neuron disease,Severe motor impairment and mild respiratory problems,(combined DW),0.413,0.286,0.553
875,"Moderate motor impairment, severe respiratory problems, and speech problems due to motor neuron disease",Moderate motor impairment with severe respiratory problems and speech problems,(combined DW),0.472,0.339,0.611
876,Moderate motor impairment and severe respiratory problems due to motor neuron disease,Moderate motor impairment and severe respiratory problems,(combined DW),0.414,0.281,0.559
877,Moderate motor impairment and moderate respiratory problems due to motor neuron disease,Moderate motor impairment and moderate respiratory problems,(combined DW),0.233,0.16,0.322
878,Moderate motor impairment and mild respiratory problems due to motor neuron disease,Moderate motor impairment and mild respiratory problems,(combined DW),0.029,0.015,0.051
879,Mild motor impairment and severe respiratory problems due to motor neuron disease,Mild motor impairment and severe respiratory problems,(combined DW),0.443,0.311,0.587
880,Mild motor impairment and mild respiratory problems due to motor neuron disease,Mild motor impairment and mild respiratory problems,(combined DW),0.079,0.05,0.117
